{
  "id": "rule-verified",
  "status": "hard",
  "trigger": {
    "product": ["shapewear"],
    "assetType": ["storyboard"],
    "shotType": ["close_up"],
    "motionType": ["pull"],
    "peopleCountRange": { "min": 1, "max": 2 },
    "spaceComplexity": ["simple"]
  },
  "symptom": "waistband deformation",
  "evidence": ["run-verified"],
  "reason": "reference conflict",
  "correction": "isolate product structure",
  "forbidden": ["storyboard controls product structure"],
  "sourceProject": "project-ready",
  "sourceSegment": "segment-001",
  "applications": [
    {
      "runId": "run-verified",
      "revision": 1,
      "appliedAt": "2026-07-13T01:00:00.000Z",
      "reviewId": "review-rule-verified"
    }
  ],
  "verificationReviewId": "review-rule-verified",
  "revision": 1,
  "createdAt": "2026-07-13T00:00:00.000Z",
  "updatedAt": "2026-07-13T02:00:00.000Z"
}
